{
  "$schema": "https://json-schema.org/draft/2020-12/schema",
  "$id": "https://zurvival.example/schemas/project.schema.json",
  "title": "Terminal project",
  "description": "One way a run can END WELL (M5 task T87 · FR-STY-06 groundwork · GDD Part XVI \"Legacy: the run resolves toward its ending — hold, escape, sacrifice, or fall\"). Static, content-as-data definition of a staged undertaking the base builds. The engine (sim/project.ts) is a generic interpreter — no per-project branching: it offers a commit verb for each project at the player's own shelter, then the NEXT unfinished stage of whatever was committed to, debits ONE accepted payment, spends `timeCost` hours, applies the stage's `escalation`, and on the last stage sets `ending.escaped` or `ending.held` — which is the only thing `runEndReason` reads. Committing is EXCLUSIVE: one project per run, so the second is the road not taken. A stage is paid with ANY ONE entry of its `accepts` menu, never a bill of materials: measured (measure/t87.ts --ledger-immortal), the city hands an immortal 36-day run about 6 scrap and roughly ONE each of eight other things, so a conjunctive cost is unpayable while a disjunctive one is payable many ways — and that is what turns the items nothing ever wanted (batteries, lighter, blanket) into alternate payments rather than hard gates. Every stage RAISES something, because the whole point is that building toward the ending makes the city harder.",
  "type": "object",
  "required": ["id", "kind", "label", "premise", "stages", "ending"],
  "additionalProperties": false,
  "$defs": {
    "itemId": {
      "type": "string",
      "pattern": "^item(\\.[a-z0-9]+(?:[-_][a-z0-9]+)*)+$",
      "description": "An item content id, e.g. \"item.scrap\"."
    },
    "payment": {
      "type": "object",
      "required": ["item", "qty"],
      "additionalProperties": false,
      "properties": {
        "item": { "$ref": "#/$defs/itemId" },
        "qty": { "type": "integer", "minimum": 1, "description": "Units of the item — a whole, positive count." }
      }
    },
    "escalation": {
      "type": "object",
      "additionalProperties": false,
      "minProperties": 1,
      "description": "What finishing this stage does to the world, applied once, the moment it lands. On top of this one-shot the engine adds a STANDING lift to every region's drift anchor for each completed stage (PROJECT_ALARM_PER_STAGE), so the pressure does not decay away between stages.",
      "properties": {
        "threat": { "type": "integer", "minimum": 0, "maximum": 100 },
        "survivorActivity": { "type": "integer", "minimum": 0, "maximum": 100, "description": "Rivals notice. Raising this also drains the region's loot faster (the T17 contest), so a loud project eats the city it is trying to leave." },
        "zombieDensity": { "type": "integer", "minimum": 0, "maximum": 100 },
        "scope": { "type": "string", "enum": ["region", "city"], "description": "\"region\" (the shelter's own region — the default) or \"city\" (every region)." }
      }
    },
    "stage": {
      "type": "object",
      "required": ["id", "label", "worldEffect", "accepts", "timeCost"],
      "additionalProperties": false,
      "properties": {
        "id": { "type": "string", "pattern": "^[a-z0-9]+(?:[-_][a-z0-9]+)*$", "description": "Stable slug, unique within the project. Part of the endingFlags key, so it is save data — never rename one." },
        "label": { "type": "string", "minLength": 1, "description": "The choice row (\"Patch the hull\")." },
        "worldEffect": { "type": "string", "minLength": 1, "description": "What it does in the world, never a number (\"The seams stop weeping. It will float.\")." },
        "accepts": {
          "type": "array",
          "minItems": 1,
          "maxItems": 6,
          "items": { "$ref": "#/$defs/payment" },
          "description": "Accepted payments — ANY ONE settles the stage. Ordered: the engine takes the first the player can afford, so put the payment the stage would rather have first. Price these off the measured ledger, not off what the fiction suggests: an item that is never found is fine here as an ALTERNATE and fatal as the only entry."
        },
        "timeCost": { "type": "integer", "minimum": 1, "description": "Hours the stage costs. > 0, so every stage is a resolved, world-advancing turn (FR-CORE-03)." },
        "noise": { "type": "integer", "minimum": 0, "maximum": 100, "description": "Deposited at the node by pipeline stage 6, exactly as a firearm or a molotov is." },
        "escalation": { "$ref": "#/$defs/escalation" }
      }
    }
  },
  "properties": {
    "$schema": { "type": "string", "description": "Optional editor hint pointing at this schema." },
    "id": {
      "type": "string",
      "pattern": "^project\\.(departure|holdout)\\.[a-z0-9]+(?:[-_][a-z0-9]+)*$",
      "description": "Stable content id of the form project.<departure|holdout>.<slug>. It is part of every endingFlags key this project writes, so it is SAVE DATA — never rename a shipped project."
    },
    "kind": {
      "type": "string",
      "enum": ["escape", "holdout"],
      "description": "Which ending finishing this project resolves to: \"escape\" sets ending.escaped, \"holdout\" sets ending.held."
    },
    "label": { "type": "string", "minLength": 1, "description": "The project's name, as the base would say it." },
    "premise": { "type": "string", "minLength": 1, "description": "The commit row's prose — what you are choosing, in the world's words, with no numbers in it." },
    "stages": {
      "type": "array",
      "minItems": 1,
      "maxItems": 6,
      "items": { "$ref": "#/$defs/stage" },
      "description": "Ordered. A stage is offered only once every earlier one is done."
    },
    "ending": { "type": "string", "minLength": 1, "description": "The run's closing narration when the last stage lands. A scene, not a scoreboard (GDD IX rule 5)." }
  }
}
